{
  "class":"Cloud_Failover",
  "environment":"azure",
  "controls":{
     "class":"Controls",
     "logLevel":"silly"
  },
  "externalStorage":{
     "scopingTags":{
        "f5_cloud_failover_label":"mydeployment"
     }
  },
  "failoverAddresses":{
     "enabled":true,
     "scopingTags":{
        "f5_cloud_failover_label":"mydeployment"
     }
  },
  "failoverRoutes":{
     "enabled":true,
     "defaultResourceLocations":[
        {
           "subscriptionId":"1111"
        },
        {
           "subscriptionId":"2222"
        }
     ],
     "routeGroupDefinitions":[
        {
           "scopingName":"myroutetable-1",
           "scopingAddressRanges":[
              {
                 "range":"100.100.101.0/29"
              },
              {
                 "range":"100.100.102.0/29"
              }
           ],
           "defaultNextHopAddresses":{
              "discoveryType":"static",
              "items":[
                 "10.0.12.11",
                 "10.0.12.12"
              ]
           }
        },
        {
           "scopingName":"myroutetable-2",
           "scopingAddressRanges":[
              {
                 "range":"0.0.0.0/0"
              }
           ],
           "defaultNextHopAddresses":{
              "discoveryType":"static",
              "items":[
                 "10.0.13.11",
                 "10.0.13.12"
              ]
           }
        }
     ]
  }
}