{
  "class":"Cloud_Failover",
  "environment":"aws",
  "controls":{
     "class":"Controls",
     "logLevel":"silly"
  },
  "externalStorage":{
     "scopingTags":{
        "f5_cloud_failover_label":"mydeployment"
     }
  },
  "failoverAddresses":{
     "enabled":true,
      "scopingTags":{
        "f5_cloud_failover_label":"mydeployment"
      },
     "addressGroupDefinitions": [
      {
        "type": "networkInterfaceAddress",
        "scopingAddress": "10.0.1.1"
      },
      {
        "type": "elasticIpAddress",
        "scopingAddress": "23.1.2.3",
        "vipAddresses": [
          "10.0.12.116",
          "10.0.22.116"
        ]
      }
    ]
  },
  "failoverRoutes":{
     "enabled":true,
     "routeGroupDefinitions":[
        {
           "scopingName":"rtb-11111111111111111",
           "scopingAddressRanges":[
              {
                 "range":"0.0.0.0/0"
              }
           ],
           "defaultNextHopAddresses":{
              "discoveryType":"static",
              "items":[
                 "10.0.13.11",
                 "10.0.23.11"
              ]
           }
        }
     ]
  }
}
