{
    "class":"Cloud_Failover",
    "environment":"gcp",
    "controls":{
       "class":"Controls",
       "logLevel":"silly"
    },
    "externalStorage":{
       "scopingTags":{
          "f5_cloud_failover_label":"mydeployment"
       }
    },
    "failoverAddresses":{
       "enabled":true,
       "scopingTags":{
          "f5_cloud_failover_label":"mydeployment"
       }
    },
    "failoverRoutes":{
       "enabled":true,
       "routeGroupDefinitions":[
          {
             "scopingName":"default-route-for-applications",
             "defaultNextHopAddresses":{
                "discoveryType":"static",
                "items":[
                   "10.0.13.11",
                   "10.0.13.12"
                ]
             }
          },
          {
             "scopingName":"route-name-2",
             "defaultNextHopAddresses":{
                "discoveryType":"static",
                "items":[
                   "10.0.14.11",
                   "10.0.14.12"
                ]
             }
          }
       ]
    }
 }