{
    "class": "Cloud_Failover",
    "environment": "azure",
	"externalStorage": {
		"scopingTags": {
			"f5_cloud_failover_label": "mydeployment"
		}
    },
	"failoverAddresses": {
		"scopingTags": {
			"f5_cloud_failover_label": "mydeployment"
		}
    },
    "failoverRoutes": {
		"scopingTags": {
			"f5_cloud_failover_label": "mydeployment"
		},
		"scopingAddressRanges": [
			"192.168.1.0/24"
		],
		"nextHopAddresses": {
			"discoveryType": "address",
			"items": [
				"192.0.2.10",
				"192.0.2.11"
			]
		}
    }
}