{
  "class": "Cloud_Failover",
  "environment": "aws",
  "controls": {
    "class": "Controls",
    "logLevel": "silly"
  },
  "externalStorage": {
    "scopingName": "myCloudFailoverBucket"
  },
  "failoverAddresses": {
    "enabled": true,
    "scopingTags": {
      "f5_cloud_failover_label": "mydeployment",
      "encryption": {
        "serverSide": {
          "enabled": true,
          "algorithm": "AES256"
        }
      }
    },
    "addressGroupDefinitions": [
      {
        "type": "elasticIpAddress",
        "scopingAddress": "1.1.1.1",
        "vipAddresses": [
          "10.0.12.101",
          "10.0.22.101"
        ]
      },
      {
        "type": "elasticIpAddress",
        "scopingAddress": "2.2.2.2",
        "vipAddresses": [
          "10.0.12.102",
          "10.0.22.102"
        ]
      }
    ]
  },
  "failoverRoutes": {
    "enabled": true,
    "routeGroupDefinitions": [
      {
        "scopingName": "rtb-11111111111111111",
        "scopingAddressRanges": [
          {
            "range": "0.0.0.0/0"
          }
        ],
        "defaultNextHopAddresses": {
          "discoveryType": "static",
          "items": [
            "10.0.13.11",
            "10.0.23.11"
          ]
        }
      }
    ]
  }
}
