{
  "class": "Cloud_Failover",
  "environment": "aws",
  "controls": {
    "class": "Controls",
    "logLevel": "silly"
  },
  "externalStorage": {
    "scopingTags": {
      "f5_cloud_failover_label": "mydeployment"
    },
    "encryption": {
      "serverSide": {
        "enabled": true,
        "algorithm": "aws:kms",
        "keyId": "myCustomKmsKey"
      }
    }
  },
  "failoverAddresses": {
    "enabled": true,
    "scopingTags": {
      "f5_cloud_failover_label": "mydeployment"
    }
  },
  "failoverRoutes": {
    "enabled": true,
    "scopingTags": {
      "f5_cloud_failover_label": "mydeployment"
    },
    "scopingAddressRanges": [
      {
        "range": "0.0.0.0/0",
        "nextHopAddresses": {
          "discoveryType": "routeTag"
        }
      }
    ]
  }
}
