{
  "class": "Cloud_Failover",
  "environment": "gcp",
  "externalStorage": {
    "scopingName": "myCloudFailoverBucket"
  },
  "failoverAddresses": {
    "enabled": true,
    "addressGroupDefinitions": [
      {
        "type": "forwardingRule",
        "scopingName": "forwarding-rule-1-1-1-1",
        "targetInstances": [
          "ti-cluster-1-a",
          "ti-cluster-1-b"
        ]
      },
      {
        "type": "aliasAddress",
        "scopingAddress": "10.0.12.101/28"
      }
    ]
  },
  "failoverRoutes": {
    "enabled": true,
    "routeGroupDefinitions": [
      {
        "scopingName": "example-route-1",
        "defaultNextHopAddresses": {
          "discoveryType": "static",
          "items": [
            "10.0.13.11",
            "10.0.13.12"
          ]
        }
      }
    ]
  }
}
