{
    "class": "Cloud_Failover",
    "environment": "gcp",
	"externalStorage": {
		"scopingTags": {
			"f5_cloud_failover_label": "mydeployment"
		}
    },
	"failoverAddresses": {
		"scopingTags": {
			"f5_cloud_failover_label": "mydeployment"
		}
    },
    "failoverRoutes": {
		"scopingTags": {
			"f5_cloud_failover_label": "mydeployment"
		},
		"scopingAddressRanges": [
			"192.168.1.0/24"
		]
    }
}