{
   "class":"Cloud_Failover",
   "environment":"azure",
   "controls":{
      "class":"Controls",
      "logLevel":"silly"
   },
   "externalStorage":{
      "scopingTags":{
         "f5_cloud_failover_label":"mydeployment"
      }
   },
   "failoverAddresses":{
      "enabled":true,
      "addressGroupDefinitions": [
         {
            "type": "networkInterfaceAddress",
            "scopingAddress": "10.0.1.2",
            "networkInterfaces": [
               "test-nic01",
               "test-nic02"
            ]
         }
      ]
   },
   "failoverRoutes":{
      "enabled":true,
      "routeGroupDefinitions":[
         {
            "scopingName":"myroutetable-1",
            "scopingAddressRanges":[
               {
                  "range":"0.0.0.0/0"
               }
            ],
            "defaultNextHopAddresses":{
               "discoveryType":"static",
               "items":[
                  "10.0.13.11",
                  "10.0.23.11"
               ]
            }
         }
      ]
   }
 }
