{
    "class": "Cloud_Failover",
    "environment": "azure",
	"externalStorage": {
		"scopingTags": {
			"F5_CLOUD_FAILOVER_LABEL": "mydeployment"
		}
    },
	"failoverAddresses": {
		"scopingTags": {
			"F5_CLOUD_FAILOVER_LABEL": "mydeployment"
		}
    },
    "failoverRoutes": {
		"scopingTags": {
			"F5_CLOUD_FAILOVER_LABEL": "mydeployment"
		},
		"scopingAddressRanges": [
			"192.168.1.0/24"
		]
    }
}