{
  "class":"Cloud_Failover",
  "environment":"aws",
  "externalStorage":{
     "scopingTags":{
        "f5_cloud_failover_label":"mydeployment"
     }
  },
  "failoverAddresses":{
     "enabled":true,
     "scopingTags":{
        "f5_cloud_failover_label":"mydeployment"
     }
  },
  "failoverRoutes":{
     "enabled":true,
     "routeGroupDefinitions":[
        {
           "scopingTags":{
              "f5_cloud_failover_label":"DMZ-RouteTable"
           },
           "scopingAddressRanges":[
              {
                 "range":"192.168.1.0/24"
              },
              {
                 "range":"192.168.1.1/24"
              }
           ],
           "defaultNextHopAddresses":{
              "discoveryType":"routeTag"
           }
        },
        {
           "scopingTags":{
              "f5_cloud_failover_label":"Internal-RouteTable"
           },
           "scopingAddressRanges":[
              {
                 "range":"0.0.0.0/0"
              }
           ],
           "defaultNextHopAddresses":{
              "discoveryType":"routeTag"
           }
        }
     ]
  }
}